{
  "schema": "smml.profile/1",
  "id": "survival-industrial",
  "name": "Survival Industrial",
  "description": "Reference GP1 profile fixture.",
  "target": {
    "steamAppId": 387990,
    "gameVersions": [
      "1.0.6"
    ],
    "engineBuilds": [
      889
    ],
    "steamBuildIds": [
      "25442087"
    ],
    "steamBranches": [
      "public"
    ],
    "canonicalGameFingerprints": [
      "f8356e5f0b660320bdcd196bc553114d688aeff43f20872438cbac1e1bc9668c"
    ]
  },
  "packages": [
    {
      "id": "com.example.pallet64",
      "range": ">=1.0.0 <2.0.0"
    }
  ],
  "policies": {
    "softDependencies": "selected-only",
    "providerAmbiguity": "error",
    "capabilityProviders": [
      {
        "id": "smml.api",
        "version": 1,
        "providers": [
          "org.smml.api"
        ]
      }
    ]
  }
}
